{
  "schema_version": "incidentseal-workflow-execution-contract/v1",
  "contract_id": "INCIDENTSEAL-WORKFLOW-EXECUTION-001",
  "revision": 1,
  "identity": {
    "manifest_schema": "incidentseal-workflow/v1",
    "approval_schema": "incidentseal-manifest-approval/v1",
    "command": "incidentseal verify --manifest PATH --json",
    "event_stream_command": "incidentseal run events --run-id ID --jsonl"
  },
  "authority": {
    "required_status": "MATCH",
    "exact_manifest_digest": true,
    "exact_workflow_id": true,
    "exact_repository_remote": true,
    "exact_manifest_path": true,
    "unexpired": true,
    "agent_can_approve": false,
    "recheck_before_each_step": true,
    "non_match_verdict": "INVALID",
    "non_match_exit": 12
  },
  "repository": {
    "manifest_inside_git_worktree": true,
    "origin_remote_exact": true,
    "head_commit_exact": true,
    "worktree_clean": true,
    "tree_digest_algorithm": "sha256-git-ls-tree-z-v1",
    "tree_digest_command": ["git", "ls-tree", "-r", "-z", "--full-tree", "COMMIT"],
    "tracked_regular_files_only": true,
    "symlinks_denied": true,
    "submodules_denied": true
  },
  "staging": {
    "source": "exact-commit-declared-inputs-only",
    "copy_only": true,
    "read_only_runtime_mount": "/workspace",
    "manifest_cwd_beneath_workspace": true,
    "overlapping_inputs_denied": true,
    "persistent_outputs_supported": false,
    "maximum_files": 4096,
    "maximum_total_bytes": 104857600,
    "repository_custody_denied": true,
    "onedrive_custody_denied": true,
    "symlink_reparse_escape_denied": true,
    "temporary_staging_removed_after_terminal": true
  },
  "runtime": {
    "supported_runners": ["python", "node"],
    "unsupported_runner_verdict": "INVALID",
    "unsupported_runner_exit": 12,
    "image_authority": "requirements/topology-runtime.lock.json#exact-image-id",
    "direct_argv_without_shell": true,
    "host_cli_owns_docker": true,
    "docker_socket": "denied",
    "secrets": "denied",
    "privileged": false,
    "host_network": false,
    "runtime_network": "none",
    "broad_host_mounts": "denied",
    "read_only_root": true,
    "numeric_user": "65532:65532",
    "capabilities": "drop-all",
    "no_new_privileges": true,
    "pids_limit": 64,
    "memory_bytes": 536870912,
    "tmpfs": "/tmp:size=67108864,mode=0700,uid=65532,gid=65532",
    "environment_allowlist": ["HOME", "PYTHONDONTWRITEBYTECODE", "PYTHONHASHSEED", "TZ"],
    "host_environment_forwarded": false,
    "exact_run_and_step_labels": true,
    "exact_owned_container_stop_only": true
  },
  "evidence": {
    "state_root": "platform-default-incidentseal-runs-v1",
    "outside_repository": true,
    "outside_onedrive": true,
    "restrictive_custody": true,
    "append_only_events": true,
    "event_schema": "incidentseal-run-event/v1",
    "agent_event_stream_read_only": true,
    "event_rewrite_denied": true,
    "atomic_fsync_before_progress": true,
    "content_addressed_step_records": true,
    "capture_policy_from_manifest": true,
    "capture_limit_enforced_before_write": true,
    "portable_receipt_after_terminal": true,
    "verification_verdicts": ["PASS", "FAIL", "INCONCLUSIVE", "INVALID"],
    "lifecycle_states": ["queued", "running", "completed", "cancelled", "failed", "stale", "superseded"],
    "retain_attempts": "all"
  },
  "recovery": {
    "active_key": "repository-remote+workflow-id+manifest-digest+commit+tree-digest",
    "same_key_resumes_nonterminal_run": true,
    "different_digest_never_resumes": true,
    "terminal_run_never_rewritten": true,
    "safe_step_replay_basis": "read-only-input-no-network-no-persistent-output",
    "started_step_reobserved_before_replay": true,
    "unknown_owned_runtime": "INCONCLUSIVE",
    "conflicting_owned_runtime": "FAIL",
    "interrupt_stops_exact_owned_container": true,
    "interrupt_lifecycle": "cancelled",
    "interrupt_verdict": null,
    "interrupt_exit": 20
  },
  "claim": {
    "required_steps_all_pass": true,
    "dependency_order_enforced": true,
    "unexpected_step_exit": "FAIL",
    "missing_required_evidence": "INCONCLUSIVE",
    "invalid_policy_input_or_custody": "INVALID",
    "non_completed_lifecycle_verdict": null,
    "claim_permitted_only_on_pass": true
  },
  "cli": {
    "stdout": "one-incidentseal-cli-envelope-v1-json-line",
    "stderr": "diagnostics-only",
    "data_includes_run_id": true,
    "evidence_references_include_sha256": true,
    "process_exit_matches_envelope": true,
    "pass_exit": 0,
    "fail_exit": 10,
    "inconclusive_exit": 11,
    "invalid_exit": 12,
    "cancelled_exit": 20,
    "failed_lifecycle_exit": 21,
    "stale_exit": 22,
    "superseded_exit": 23
  },
  "release_gate": {
    "required_before_packaging": true,
    "credential_free_public_replay_required": true,
    "package_build_before_pass": false
  }
}
